{
  "gate": "g6f1c2b3a4d5e6f70",
  "workItem": "https://github.com/acme/web/pull/6",
  "stage": "merge",
  "summary": "Merge the new checkout flow",
  "request": "sha256:3b7c5d1f0a9e8d7c6b5a4f3e2d1c0b9a8f7e6d5c4b3a2f1e0d9c8b7a6f5e4d3c",
  "policy": "policy.rego",
  "policyDigest": "sha256:0a1b2c3d4e5f60718293a4b5c6d7e8f90a1b2c3d4e5f60718293a4b5c6d7e8f9",
  "risk": "high",
  "approvers": ["maintainers"],
  "channel": "slack:C0GATES",
  "requestedAt": "2026-01-01T00:00:00.000001Z",
  "decision": "approved",
  "decidedBy": { "kind": "person", "id": "slack:U0ADA" },
  "decidedAt": "2026-01-01T00:12:00.000002Z",
  "signature": {
    "algorithm": "Ed25519",
    "key": "sha256:5e2d0c7a1f4b9e3d6c8a2f5b1e7d4c9a3f6b0e8d2c5a7f1b4e9d3c6a0f8b2e5d",
    "value": "c2lnbmF0dXJlIGJ5dGVzIG9mIGEgZml4dHVyZQ=="
  }
}
